{
  "$schema": "https://json-schema.org/draft/2020-12/schema",
  "$id": "https://casetrace.local/schemas/artifact-record.schema.json",
  "title": "ArtifactRecord",
  "type": "object",
  "additionalProperties": false,
  "required": [
    "artifact_type",
    "source_file",
    "record_id",
    "event_time_start",
    "event_time_end",
    "actor",
    "counterparty",
    "location",
    "content_summary",
    "raw_ref",
    "deleted_flag",
    "confidence",
    "parser_version"
  ],
  "properties": {
    "artifact_type": {
      "type": "string",
      "enum": [
        "message",
        "call",
        "browser_visit",
        "location_point",
        "photo",
        "app_event",
        "recovered_record"
      ]
    },
    "source_file": {
      "type": "string",
      "pattern": "^/data/user/0/com\\.casetrace\\.waypoint/.+$"
    },
    "record_id": {
      "type": "string",
      "pattern": "^[a-z]+-[0-9]{3}$"
    },
    "event_time_start": {
      "type": "string",
      "format": "date-time",
      "pattern": "^\\d{4}-\\d{2}-\\d{2}T\\d{2}:\\d{2}:\\d{2}Z$"
    },
    "event_time_end": {
      "type": "string",
      "format": "date-time",
      "pattern": "^\\d{4}-\\d{2}-\\d{2}T\\d{2}:\\d{2}:\\d{2}Z$"
    },
    "actor": {
      "type": ["string", "null"],
      "minLength": 1
    },
    "counterparty": {
      "type": ["string", "null"],
      "minLength": 1
    },
    "location": {
      "type": ["object", "null"],
      "additionalProperties": false,
      "required": ["latitude", "longitude", "accuracy_m", "label"],
      "properties": {
        "latitude": {
          "type": "number",
          "minimum": -90,
          "maximum": 90
        },
        "longitude": {
          "type": "number",
          "minimum": -180,
          "maximum": 180
        },
        "accuracy_m": {
          "type": "number",
          "minimum": 0
        },
        "label": {
          "type": "string",
          "minLength": 1
        }
      }
    },
    "content_summary": {
      "type": "string",
      "minLength": 1
    },
    "raw_ref": {
      "type": "string",
      "pattern": "^(db|file)://.+$"
    },
    "deleted_flag": {
      "type": "boolean"
    },
    "confidence": {
      "type": "number",
      "minimum": 0.0,
      "maximum": 1.0
    },
    "parser_version": {
      "type": "string",
      "pattern": "^phase0-spec/[0-9]+\\.[0-9]+\\.[0-9]+$"
    }
  },
  "allOf": [
    {
      "if": {
        "properties": {
          "artifact_type": {
            "const": "recovered_record"
          }
        }
      },
      "then": {
        "properties": {
          "deleted_flag": {
            "const": true
          },
          "confidence": {
            "type": "number",
            "maximum": 0.75
          }
        }
      }
    }
  ]
}

