{
  "artifact_type": "browser_visit",
  "source_file": "/data/user/0/com.casetrace.waypoint/databases/waypoint_web.db",
  "record_id": "web-001",
  "event_time_start": "2026-03-12T12:22:00Z",
  "event_time_end": "2026-03-12T12:22:00Z",
  "actor": "Jordan Vega",
  "counterparty": null,
  "location": null,
  "content_summary": "Visited https://maps.example/transit/east-line for morning route timing.",
  "raw_ref": "db://files/databases/waypoint_web.db#table=browser_history&rowid=1",
  "deleted_flag": false,
  "confidence": 0.96,
  "parser_version": "phase0-spec/1.0.0"
}

