{
  "artifact_type": "call",
  "source_file": "/data/user/0/com.casetrace.waypoint/databases/waypoint_core.db",
  "record_id": "call-001",
  "event_time_start": "2026-03-12T13:05:00Z",
  "event_time_end": "2026-03-12T13:09:00Z",
  "actor": "Jordan Vega",
  "counterparty": "Alex Mercer",
  "location": null,
  "content_summary": "Outbound call discussing parking validation near North Pier Garage.",
  "raw_ref": "db://files/databases/waypoint_core.db#table=calls&rowid=21",
  "deleted_flag": false,
  "confidence": 0.97,
  "parser_version": "phase0-spec/1.0.0"
}

